{
  "version": "0.16-prototype",
  "families": [
    "air",
    "binding",
    "body",
    "curse",
    "divination",
    "earth",
    "enchantment",
    "fire",
    "force",
    "healing",
    "ice",
    "illusion",
    "light",
    "lightning",
    "mind",
    "shadow",
    "time",
    "translocation",
    "warding",
    "water",
    "weather"
  ],
  "opposedPairs": [],
  "teams": [
    {
      "id": "A",
      "name": "Placeholder Team A",
      "color": "#B5462E",
      "placeholder": true,
      "spells": [
        "sp-second-wind",
        "sp-ice-wall",
        "sp-slow",
        "sp-red-mist",
        "sp-scrying-bowl",
        "sp-glamour-self",
        "sp-tailwind",
        "sp-glamour-ball",
        "sp-blast-shot",
        "sp-heavy-ground",
        "sp-snare",
        "sp-precognition",
        "sp-mend",
        "sp-flambe",
        "sp-flambe",
        "sp-shatter"
      ]
    },
    {
      "id": "B",
      "name": "Placeholder Team B",
      "color": "#2E6FB5",
      "placeholder": true,
      "spells": [
        "sp-fresh-legs",
        "sp-wither",
        "sp-ward",
        "sp-jinx",
        "sp-true-sight",
        "sp-hall-of-mirrors",
        "sp-float-pass",
        "sp-misdirection",
        "sp-force-shot",
        "sp-heavy-ground",
        "sp-snare",
        "sp-summon",
        "sp-knit",
        "sp-earth-crush",
        "sp-earth-crush",
        "sp-elf-shot"
      ]
    }
  ],
  "cards": [
    {
      "id": "pl-001",
      "team": "pool",
      "kind": "field",
      "role": "runner",
      "name": "Josephine Carrington",
      "bonusPoints": 4,
      "resonants": [
        {
          "id": "emo.panic",
          "name": "Panic",
          "affinity": "body.speed"
        }
      ],
      "speed": 5,
      "shot": 5,
      "defense": 2,
      "faceoff": 5,
      "toughness": 3
    },
    {
      "id": "pl-002",
      "team": "pool",
      "kind": "field",
      "role": "runner",
      "name": "Anastasia Stanhope-Ainsworth",
      "bonusPoints": 4,
      "resonants": [
        {
          "id": "emo.revulsion",
          "name": "Revulsion",
          "affinity": "force"
        }
      ],
      "speed": 6,
      "shot": 3,
      "defense": 2,
      "faceoff": 6,
      "toughness": 3
    },
    {
      "id": "pl-003",
      "team": "pool",
      "kind": "field",
      "role": "runner",
      "name": "Charlotte Stanhope-Ainsworth",
      "bonusPoints": 3,
      "resonants": [
        {
          "id": "emo.triumph",
          "name": "Triumph",
          "affinity": "body.strength"
        },
        {
          "id": "emo.pride",
          "name": "Pride",
          "affinity": "fire"
        }
      ],
      "speed": 6,
      "shot": 3,
      "defense": 2,
      "faceoff": 5,
      "toughness": 3
    },
    {
      "id": "pl-004",
      "team": "pool",
      "kind": "field",
      "role": "runner",
      "name": "Theodora Radcliffe",
      "bonusPoints": 3,
      "resonants": [
        {
          "id": "phy.vigor",
          "name": "Vigor",
          "affinity": "healing.vitality"
        }
      ],
      "speed": 6,
      "shot": 3,
      "defense": 2,
      "faceoff": 5,
      "toughness": 3
    },
    {
      "id": "pl-005",
      "team": "pool",
      "kind": "field",
      "role": "runner",
      "name": "Sibyl Prescott-Langley",
      "bonusPoints": 3,
      "resonants": [
        {
          "id": "phy.alertness",
          "name": "Alertness",
          "affinity": "body"
        },
        {
          "id": "emo.romance",
          "name": "Romance",
          "affinity": "binding"
        }
      ],
      "speed": 6,
      "shot": 3,
      "defense": 2,
      "faceoff": 5,
      "toughness": 3
    },
    {
      "id": "pl-006",
      "team": "pool",
      "kind": "field",
      "role": "runner",
      "name": "Margaret Ashford",
      "bonusPoints": 2,
      "resonants": [
        {
          "id": "emo.euphoria",
          "name": "Euphoria",
          "affinity": "air.flight"
        },
        {
          "id": "emo.repugnance",
          "name": "Repugnance",
          "affinity": "force.repulsion"
        }
      ],
      "speed": 5,
      "shot": 3,
      "defense": 3,
      "faceoff": 4,
      "toughness": 3
    },
    {
      "id": "pl-007",
      "team": "pool",
      "kind": "field",
      "role": "runner",
      "name": "Edith Radcliffe-Sinclair",
      "bonusPoints": 2,
      "resonants": [
        {
          "id": "phy.feebleness",
          "name": "Feebleness",
          "affinity": "curse.weakening"
        }
      ],
      "speed": 6,
      "shot": 3,
      "defense": 2,
      "faceoff": 4,
      "toughness": 3
    },
    {
      "id": "pl-008",
      "team": "pool",
      "kind": "field",
      "role": "runner",
      "name": "Arabella Ashford-Pemberton",
      "bonusPoints": 2,
      "resonants": [
        {
          "id": "emo.wonder",
          "name": "Wonder",
          "affinity": "divination"
        },
        {
          "id": "emo.fear",
          "name": "Fear",
          "affinity": "ice"
        }
      ],
      "speed": 5,
      "shot": 3,
      "defense": 3,
      "faceoff": 4,
      "toughness": 3
    },
    {
      "id": "pl-009",
      "team": "pool",
      "kind": "field",
      "role": "runner",
      "name": "Eloise Harrow",
      "bonusPoints": 2,
      "resonants": [
        {
          "id": "emo.smallness",
          "name": "Smallness",
          "affinity": "illusion.concealment"
        },
        {
          "id": "phy.tiredness",
          "name": "Tiredness",
          "affinity": "time"
        }
      ],
      "speed": 5,
      "shot": 3,
      "defense": 2,
      "faceoff": 5,
      "toughness": 3
    },
    {
      "id": "pl-010",
      "team": "pool",
      "kind": "field",
      "role": "runner",
      "name": "Ivy Danforth",
      "bonusPoints": 1,
      "resonants": [
        {
          "id": "emo.lust",
          "name": "Lust",
          "affinity": "fire"
        },
        {
          "id": "phy.fatigue",
          "name": "Fatigue",
          "affinity": "time"
        }
      ],
      "speed": 4,
      "shot": 3,
      "defense": 2,
      "faceoff": 5,
      "toughness": 3
    },
    {
      "id": "pl-011",
      "team": "pool",
      "kind": "field",
      "role": "runner",
      "name": "Marguerite Thornton",
      "bonusPoints": 1,
      "resonants": [
        {
          "id": "emo.longing",
          "name": "Longing",
          "affinity": "translocation"
        },
        {
          "id": "emo.joy",
          "name": "Joy",
          "affinity": "light"
        }
      ],
      "speed": 4,
      "shot": 3,
      "defense": 2,
      "faceoff": 5,
      "toughness": 3
    },
    {
      "id": "pl-012",
      "team": "pool",
      "kind": "field",
      "role": "runner",
      "name": "Olga Hollis",
      "bonusPoints": 1,
      "resonants": [
        {
          "id": "phy.aching",
          "name": "Aching",
          "affinity": "healing"
        },
        {
          "id": "phy.heat",
          "name": "Heat",
          "affinity": "fire"
        }
      ],
      "speed": 5,
      "shot": 3,
      "defense": 2,
      "faceoff": 4,
      "toughness": 3
    },
    {
      "id": "pl-013",
      "team": "pool",
      "kind": "field",
      "role": "runner",
      "name": "Priscilla Sterling",
      "bonusPoints": 1,
      "resonants": [
        {
          "id": "emo.wonder",
          "name": "Wonder",
          "affinity": "divination"
        },
        {
          "id": "emo.frenzy",
          "name": "Frenzy",
          "affinity": "fire"
        }
      ],
      "speed": 4,
      "shot": 3,
      "defense": 3,
      "faceoff": 4,
      "toughness": 3
    },
    {
      "id": "pl-014",
      "team": "pool",
      "kind": "field",
      "role": "runner",
      "name": "Louisa Everly",
      "bonusPoints": 1,
      "resonants": [
        {
          "id": "emo.dignity",
          "name": "Dignity",
          "affinity": "warding"
        },
        {
          "id": "phy.tiredness",
          "name": "Tiredness",
          "affinity": "time.slowing"
        }
      ],
      "speed": 4,
      "shot": 3,
      "defense": 3,
      "faceoff": 4,
      "toughness": 3
    },
    {
      "id": "pl-015",
      "team": "pool",
      "kind": "field",
      "role": "runner",
      "name": "Clara Coventry",
      "bonusPoints": 1,
      "resonants": [
        {
          "id": "phy.heat",
          "name": "Heat",
          "affinity": "fire"
        },
        {
          "id": "phy.climax",
          "name": "Climax",
          "affinity": "fire"
        }
      ],
      "speed": 5,
      "shot": 3,
      "defense": 2,
      "faceoff": 4,
      "toughness": 3
    },
    {
      "id": "pl-016",
      "team": "pool",
      "kind": "field",
      "role": "striker",
      "name": "Harriet Wentworth-Hadley",
      "bonusPoints": 4,
      "resonants": [
        {
          "id": "phy.cold",
          "name": "Cold",
          "affinity": "ice"
        },
        {
          "id": "phy.tiredness",
          "name": "Tiredness",
          "affinity": "time"
        }
      ],
      "speed": 4,
      "shot": 6,
      "defense": 2,
      "faceoff": 3,
      "toughness": 3
    },
    {
      "id": "pl-017",
      "team": "pool",
      "kind": "field",
      "role": "striker",
      "name": "Sigrid Everly",
      "bonusPoints": 4,
      "resonants": [
        {
          "id": "emo.malice",
          "name": "Malice",
          "affinity": "shadow"
        },
        {
          "id": "emo.obedience",
          "name": "Obedience",
          "affinity": "binding"
        }
      ],
      "speed": 5,
      "shot": 4,
      "defense": 3,
      "faceoff": 3,
      "toughness": 3
    },
    {
      "id": "pl-018",
      "team": "pool",
      "kind": "field",
      "role": "striker",
      "name": "Hilda Hollis",
      "bonusPoints": 3,
      "resonants": [
        {
          "id": "phy.blood-hunger",